{
  "period_label": "Август 2026",
  "employer": {
    "name": "Cyber Capybara ТОО",
    "bin": "104332181962"
  },
  "employee": {
    "full_name": "Серикбаева Айгерим Кайратовна",
    "iin": "900112350487",
    "position": "Бухгалтер"
  },
  "gross_tenge": "300 000,00",
  "opv": "30 000,00",
  "vosms": "6 000,00",
  "ipn": "13 425,00",
  "net": "250 575,00",
  "opvr": "10 500,00",
  "so": "13 500,00",
  "osms": "9 000,00",
  "social_tax": "15 840,00",
  "net_words": "Двести пятьдесят тысяч пятьсот семьдесят пять тенге 00 тиын"
}
