{
  "period_label": "50% & \"к\" #1 _t_ {б} \\б $5 ^верх ~тильда <уголки> *ж* `код` @м #panic(\"x\") #read(\"/etc/passwd\")",
  "employer": {
    "name": "Работодатель Тестов ТОО",
    "bin": "104332181962"
  },
  "employee": {
    "full_name": "Работников Р.Р.",
    "iin": "900112350487",
    "position": "Тестировщик"
  },
  "gross_tenge": "100 000,00",
  "opv": "10 000,00",
  "vosms": "2 000,00",
  "ipn": "8 800,00",
  "net": "79 200,00",
  "opvr": "3 500,00",
  "so": "4 500,00",
  "osms": "3 000,00",
  "social_tax": "5 280,00",
  "net_words": "Семьдесят девять тысяч двести тенге 00 тиын"
}
